choppy_er_exit_results/comparison.csv

lever,value,window,scenario,n,wr,avg_win,avg_loss,payout,mean_return,pf,cagr,mdd,records,months,mean_bars,sideways_annual,sideways_records,sideways_months,sideways_cash
baseline,0,full,fees,744,0.6612903225806451,0.1420481307841204,0.19993927972347483,0.7104563494505906,0.02621368528961232,1.227922935352089,0.047920891194058735,-0.6554276346186977,63,308,74.62903225806451,-0.016638564377804716,37,280,0.08699402021789357
market_er,0,full,fees,3738,0.41359015516318887,0.06205822695274488,0.051819295228896625,1.197589173658591,-0.00472067316019203,0.6793329229794616,-0.08754006838079487,-0.915736435513244,0,308,10.283574103798824,-0.1165510650357709,0,280,0.0015892156472342486
stock_er,0,full,fees,5415,0.35678670360110804,0.07340100843347659,0.044125971867689504,1.6634423068021589,-0.0021939079818441023,0.8546040502109953,-0.06486220704849754,-0.8512111636113345,0,308,9.546814404432133,-0.12030968882748042,0,280,0.009839649421269728
market_or_original,0,full,fees,3939,0.42015740035542015,0.060261446919251865,0.05213498139267115,1.1558735672191702,-0.004910790263899231,0.6740917021125888,-0.09355078332230704,-0.9306665187882531,0,308,9.815181518151816,-0.12730698369289634,0,280,0.009165230430938089
baseline,0,full,spread,744,0.6209677419354839,0.12944696344753795,0.19375078309019156,0.6681106593890772,0.006944591775979192,0.9565668768328346,-0.008065552294463152,-0.7433567729558781,2,308,74.62903225806451,-0.10922159692095282,1,280,0.09036359749114455
market_er,0,full,spread,2894,0.28023496890117483,0.08476451922220721,0.07490480948753607,1.1316298619825174,-0.030159880122089706,0.1160572244682834,-0.2949638741090316,-0.9998816277499999,0,308,10.444022114720111,-0.4409737406253079,0,280,0.302870391683083
stock_er,0,full,spread,3332,0.22388955582232895,0.08364067584595015,0.07065446340398272,1.1837988970026685,-0.036109393211770854,0.13297087249906464,-0.3527618588512178,-0.9999860156500001,0,308,8.566026410564225,-0.5515911900982654,0,280,0.5221603099810506
market_or_original,0,full,spread,2735,0.27861060329067644,0.07058261648100814,0.07700771986675327,0.9165654638669667,-0.03588748721702961,0.11738854645983687,-0.31901547424001964,-0.9999471783500001,0,308,9.925045703839123,-0.4714833372761738,0,280,0.38203323380860754
baseline,0,validation,fees,150,0.7266666666666667,0.11906105648978627,0.14629849933434919,0.8138228145299377,0.04652944456452259,1.9715440938061526,0.13620043208769905,-0.40547834460686827,27,60,73.30666666666667,0.1280103410908599,15,54,0.08851840093506
market_er,0,validation,fees,719,0.4381084840055633,0.052781399973721596,0.0425123560501113,1.2415543356737437,-0.0007633530633138537,0.948638347723911,-0.01990872982692371,-0.4491826661054312,13,60,10.378303198887343,-0.0642903781682769,12,54,0.00022481618061633832
stock_er,0,validation,fees,954,0.3584905660377358,0.07758753372809461,0.04134089923147627,1.8767742156179505,0.001293822018181217,1.0154716708361498,0.008063613709602624,-0.4687483078911664,8,60,10.753668763102725,0.034101744996754314,6,54,0.0068608218711651275
market_or_original,0,validation,fees,758,0.44327176781002636,0.052026674005063236,0.04158400720829599,1.2511221860957147,-8.90350609494233e-05,0.9743728924202728,-0.009961454256041224,-0.388494628111794,12,60,9.903693931398417,-0.05341463087900525,11,54,0.005754686151877185
baseline,0,validation,spread,150,0.6866666666666666,0.10790105968098784,0.14172101895344671,0.7613624321769219,0.029686141708865032,1.5618140965877025,0.08284306987065815,-0.4051403031390419,17,60,73.30666666666667,0.04276213470128437,5,54,0.0934891586516652
market_er,0,validation,spread,719,0.3198887343532684,0.055762348917689726,0.05095035561476177,1.0944447441998577,-0.016814163622461575,0.5479326825115531,-0.2240222362681329,-0.7643154266830583,2,60,10.378303198887343,-0.3815938298896267,1,54,0.0018681145684519113
stock_er,0,validation,spread,954,0.2672955974842767,0.08594900976874556,0.05143029502199174,1.6711747372243055,-0.014709411665977048,0.5972499228534884,-0.2537544837099496,-0.8351621535662799,1,60,10.753668763102725,-0.38926404460953096,1,54,0.0080643869750368
market_or_original,0,validation,spread,758,0.32189973614775724,0.05460345154776367,0.05066891467274035,1.0776518877587107,-0.016781767762710034,0.5358538696131818,-0.23288193661294465,-0.7699662030737349,2,60,9.903693931398417,-0.39880351388411817,1,54,0.008059943308104132
baseline,0,test,fees,129,0.5968992248062015,0.11918952683323904,0.17363519497866095,0.6864364499828906,0.0011516544749537532,0.9661140492480261,-0.007380357615959787,-0.4132458035511837,8,56,82.10077519379846,-0.06632035767841281,7,54,0.0905528296519852
market_er,0,test,fees,790,0.4291139240506329,0.05796420075324174,0.04672010978340784,1.2406691898191369,-0.0017986145024911258,0.9181506519608609,-0.043810460776647075,-0.4471453344303322,11,56,10.354430379746836,-0.12744543972476027,10,54,1.1824761551892435e-16
stock_er,0,test,fees,1129,0.3755535872453499,0.06013154683774876,0.04225527374273059,1.4230542488934539,-0.0038035359870855585,0.855125271919399,-0.09813045272594811,-0.567328359398056,7,56,9.371124889282552,-0.15394951365573145,6,54,0.009932772214823365
market_or_original,0,test,fees,827,0.4316807738814994,0.05682744048021826,0.04882222109444156,1.1639667185622593,-0.0032152934255739022,0.8738436928890542,-0.06974550388640177,-0.49262711757887656,9,56,9.935912938331319,-0.15981090037987392,8,54,0.007532298736576258
baseline,0,test,spread,129,0.5581395348837209,0.11652481353850994,0.16553932814643033,0.7039101514018237,-0.00810817929902179,0.8554547896352753,-0.03220653385409311,-0.44816248256176294,8,56,82.10077519379846,-0.1019764253398284,7,54,0.09352650300745265
market_er,0,test,spread,790,0.34430379746835443,0.06149929534486221,0.04901438780398462,1.2547192385796284,-0.01096410702362217,0.6869619488533811,-0.18321517601957193,-0.670377681191838,6,56,10.354430379746836,-0.3137745505509208,5,54,0.0018493036004925553
stock_er,0,test,spread,1129,0.2914083259521701,0.06793441260857083,0.04552647082940094,1.492195888917857,-0.01246302472568729,0.6259676186365075,-0.27344030450137735,-0.796690835947205,1,56,9.382639503985828,-0.38794417276823273,1,54,0.01057535798988033
market_or_original,0,test,spread,827,0.34461910519951633,0.06034924152654375,0.050694751020109535,1.1904435925250818,-0.012426869670900129,0.6483643248873416,-0.21163525700800212,-0.7163424746339981,5,56,9.935912938331319,-0.34675513080508574,3,54,0.009629448467351658

choppy_er_exit_results/CONCLUSION.md

# Exit ketika ER tidak lagi choppy

ExitERsaham fullfeeWR35.68%,loss4.41%,CAGR-6.49%,side-12.03%. GabunganoriginalORmarketERfeeCAGR-9.36%,side-12.73%. Tidakada variasifullfee yangmeningkatkanCAGRatau profitdaysideways dibandingbaseline.

Denganstressspread1tickeachside,fraksimodernBEI/100shares:baselineCAGR-.81%,marketER-29.50%,stockER-35.28%,gabungan-31.90%. MarketERside-44.10%. Asumsicounterfactual, bukanbidaskhistoris. MarketERvalid2016-2020fee-1.99%/spread-22.40%;test2021-2025fee-4.38%/spread-18.32%. Kerugianbukansekadar satuperiodefull.